<?xml version="1.0" encoding="UTF-8"?>
<document xmlns:xsi="http://www.w3.org/2001/XMLSchema-instance"
          xsi:noNamespaceSchemaLocation="document.xsd">
    <parts>
        <markdown file="intro.md" />
        <markdown file="settings.md" />
        <markdown file="text-mode.md" />
        <markdown file="handshake.md" />
        <markdown file="basic-syntax.md" />
        <markdown file="escape-sequences.md" />
        <markdown file="dataref-types.md" />
        <markdown file="feature-versioning.md" />
        <chapter title="Commands">
            <chapter title="Server"><!-- TODO: add commands to get updated server timestamp etc.? -->
                <commands group="server" />
            </chapter>
            <chapter title="DataRefs">
                <commands group="dataref" />
            </chapter>
            <chapter title="X-Plane Commands">
                <commands group="xpcommand" />
            </chapter>
        </chapter>
        <markdown file="extending-protocol.md" />
        <markdown file="special-considerations.md" />
        <markdown file="../LICENSE.md" />
    </parts>
</document>
